{
  "shared_resource_id": "example_resource",
  "app_feature": "example_feature",
  "op_type": "WRITE_SESSION",
  "record_id": "4f7a1c2e9b4d5a6f8c0e1d2b3a4f5e6c",
  "timestamp": 1785283200000000,
  "sample_rate": 1,
  "size": 524288,
  "expiration_time": 1785888000000000,
  "organization_id": 1,
  "project_id": 1
}
